No.,Full Hadith,Isnad,Matan,Author's Comments,Degree,Authenticity,Topic,
54,"54- ( 1677 ) عن عروة بن عامر رضي الله عنه قال : ذكرت الطيرة عند النبي صلى الله عليه وسلم فقال : "" أحسنها الفأل ولا ترد مسلما فإذا رأى أحدكم ما يكره فليقل : اللهم لا يأتي بالحسنات إلا أنت ولا يدفع السيئات إلا أنت ولا حول ولا قوة إلا بك "" حديث صحيح رواه أبو داود بإسناد صحيح . ( ضعيف ) .[ فيه : عروة بن عامر ، وهو مختلف في صحبته ، وفيه عنعنة حبيب بن أبي ثابت ، وهو مدلس ] .",عن عروة بن عامر رضي الله عنه قال : ذكرت الطيرة عند النبي صلى الله عليه وسلم فقال, أحسنها الفأل ولا ترد مسلما فإذا رأى أحدكم ما يكره فليقل : اللهم لا يأتي بالحسنات إلا أنت ولا يدفع السيئات إلا أنت ولا حول ولا قوة إلا بك," حديث صحيح رواه أبو داود بإسناد صحيح . ( ضعيف ) .[ فيه : عروة بن عامر ، وهو مختلف في صحبته ، وفيه عنعنة حبيب بن أبي ثابت ، وهو مدلس",ضعيف,non-authentic,باب النهي عن التطير,كتاب الأمور المنهي عنها
55,"55- ( 1722 ) عن جابر رضي الله عنه قال : قال رسول الله صلى الله عليه وسلم : "" لا يُسأل بوجه الله إلا الجنة "" رواه أبو داود . ( ضعيف ) .[ فيه : سليمان بن معاذ التميمي ، ضعفه ابن معين ، وأبو زرعة وأبو حاتم الرازيان ، والنسائي ] .",عن جابر رضي الله عنه قال : قال رسول الله صلى الله عليه وسلم, لا يُسأل بوجه الله إلا الجنة," رواه أبو داود . ( ضعيف ) .[ فيه : سليمان بن معاذ التميمي ، ضعفه ابن معين ، وأبو زرعة وأبو حاتم الرازيان ، والنسائي",ضعيف,non-authentic,باب كراهة أن يسأل الإنسان بوجه اللَّه عز وجل غير الجنة وكراهة منع من سأل بالله تعالى وتشفع به,كتاب الأمور المنهي عنها
56,"56- ( 1755 ) عن أنس رضي الله عنه قال : قال رسول الله صلى الله عليه وسلم : "" إياك والالتفات في الصلاة فإن الالتفات في الصلاة هلكة فإن كان لا دب ففي التطوع لا في الفريضة "" رواه الترمذي وقال : حديث حسن صحيح . ( ضعيف ) .[ فيه : علي بن زيد بن جدعان ، وهو ضعيف ] . ",عن أنس رضي الله عنه قال : قال رسول الله صلى الله عليه وسلم, إياك والالتفات في الصلاة فإن الالتفات في الصلاة هلكة فإن كان لا دب ففي التطوع لا في الفريضة," رواه الترمذي وقال : حديث حسن صحيح . ( ضعيف ) .[ فيه : علي بن زيد بن جدعان ، وهو ضعيف ] . ",ضعيف,non-authentic,باب كراهة الالتفات في الصلاة لغير عذر,كتاب الأمور المنهي عنها
57,"57- ( 1873 ) عن ابن عباس رضي الله عنهما قال : قال رسول الله صلى الله عليه وسلم : "" من لزم الاستغفار جعل الله له من كل ضيق مخرجا ومن كل هم فرجا ورزقه من حيث لا يحتسب "" رواه أبو داود . ( ضعيف ) .[ فيه : الحكم بن مصعب ، وهو مجهول ] .",عن ابن عباس رضي الله عنهما قال : قال رسول الله صلى الله عليه وسلم, من لزم الاستغفار جعل الله له من كل ضيق مخرجا ومن كل هم فرجا ورزقه من حيث لا يحتسب," رواه أبو داود . ( ضعيف ) .[ فيه : الحكم بن مصعب ، وهو مجهول",ضعيف,non-authentic,باب الاستغفار,
,,,,,,,,
Total no. Hadith,57,,,,,,,
Total no. of Hadith Block,3,,,,,,,
Total no. of authentic,1,,,,,,,
Total no. of non-authentic,58,,,,,,,
Total no. of uthentic/non-authentic,1,,,,,,,