No.,Full Hadith,Isnad,Matan,Author's Comments,Degree,Authenticity,Topic,
19,"19- ( 798 ) عن قيس بن بشر التغلبي قال : أخبرني أبي - وكان جليسا لأبي الدرداء - قال : كان بدمشق رجل من أصحاب رسول الله صلى الله عليه وسلم يقال له ابن الحنظلية وكان رجلا متوحدا قلما يجالس الناس إنما هو صلاة فإذا فرغ فإنما هو تسبيح وتكبير حتى يأت أهله فمر بنا ونحن عند أبي الدرداء فقال له أبو الدرداء : كلمة تنفعنا ولا تضرك قال : بعث رسول الله صلى الله عليه وسلم سرية فقدمت فجاء رجل منهم فجلس في المجلس الذي يجلس فيه رسول الله صلى الله عليه وسلم فقال لرجل إلى جنبه : لو رأيتنا حين التقينا نحن والعدو فحمل فلان وطعن فقال : خذها مني وأنا والغلام الغفاري كيف ترى في قوله ؟ قال : ما أراه إلا قد بطل أجره فسمع بذلك آخر فقال : ما أرى بذلك بأس فتنازعا حتى سمع رسول الله صلى الله عليه وسلم فقال : "" سبحان الله ؟ لا بأس أن يؤجر ويحمد "" فرأيت أبا الدرداء سر بذلك وجعل يرفع رأسه إليه ويقول : أأنت سمعت ذلك من رسول الله صلى الله عليه وسلم ؟ فيقول : نعم فما زال يعيد عليه حتى إني لأقول ليبركن على ركبتيه قال فمر بنا يوم آخر فقال له أبو الدرداء : كلمة تنفعنا ولا تضرك قال : قال لنا رسول الله صلى الله عليه وسلم : "" المنفق على الخيل كالباسط يده بالصدقة لا يقبضها "" ثم مر بنا يوما آخر فقال له أبو الدرداء : كلمة تنفعنا ولا تضرك قال : قال رسول الله صلى الله عليه وسلم : "" نعم الرجل خريم الأسدي لولا طول جمته وإسبال إزاره "" فبلغ ذلك خريما فعجل فأخذ شفرة فقطع بها جمته إلى أذنيه ورفع إزاره إلى نصف ساقيه . ثم مر بنا يوما آخر فقال له أبو الدرداء : كلمة تنفعنا ولا تضرك قال : سمعت رسول الله صلى الله عليه وسلم يقول : "" إنكم قادمون على إخوانكم فأصلحوا رحالكم وأصلحوا لباسكم حتى تكونوا كأنكم شامة في الناس فإن الله لا يحب الفحش ولا التفحش "" رواه أبو داود بإسناد حسن إلا قيس بن بشر فاختلفوا في توثيقه وتضعيفه وقد روى له مسلم . ( ضعيف ) .[ فيه : قيس التغلبي ، وهو مجهول ] .",عن قيس بن بشر التغلبي قال : أخبرني أبي - وكان جليسا لأبي الدرداء - قال : كان بدمشق رجل من أصحاب رسول الله صلى الله عليه وسلم يقال له ابن الحنظلية وكان رجلا متوحدا قلما يجالس الناس إنما هو صلاة فإذا فرغ فإنما هو تسبيح وتكبير حتى يأت أهله فمر بنا ونحن عند أبي الدرداء فقال له أبو الدرداء : كلمة تنفعنا ولا تضرك قال," بعث رسول الله صلى الله عليه وسلم سرية فقدمت فجاء رجل منهم فجلس في المجلس الذي يجلس فيه رسول الله صلى الله عليه وسلم فقال لرجل إلى جنبه : لو رأيتنا حين التقينا نحن والعدو فحمل فلان وطعن فقال : خذها مني وأنا والغلام الغفاري كيف ترى في قوله ؟ قال : ما أراه إلا قد بطل أجره فسمع بذلك آخر فقال : ما أرى بذلك بأس فتنازعا حتى سمع رسول الله صلى الله عليه وسلم فقال : "" سبحان الله ؟ لا بأس أن يؤجر ويحمد "" فرأيت أبا الدرداء سر بذلك وجعل يرفع رأسه إليه ويقول : أأنت سمعت ذلك من رسول الله صلى الله عليه وسلم ؟ فيقول : نعم فما زال يعيد عليه حتى إني لأقول ليبركن على ركبتيه قال فمر بنا يوم آخر فقال له أبو الدرداء : كلمة تنفعنا ولا تضرك قال : قال لنا رسول الله صلى الله عليه وسلم : "" المنفق على الخيل كالباسط يده بالصدقة لا يقبضها "" ثم مر بنا يوما آخر فقال له أبو الدرداء : كلمة تنفعنا ولا تضرك قال : قال رسول الله صلى الله عليه وسلم : "" نعم الرجل خريم الأسدي لولا طول جمته وإسبال إزاره "" فبلغ ذلك خريما فعجل فأخذ شفرة فقطع بها جمته إلى أذنيه ورفع إزاره إلى نصف ساقيه . ثم مر بنا يوما آخر فقال له أبو الدرداء : كلمة تنفعنا ولا تضرك قال : سمعت رسول الله صلى الله عليه وسلم يقول : "" إنكم قادمون على إخوانكم فأصلحوا رحالكم وأصلحوا لباسكم حتى تكونوا كأنكم شامة في الناس فإن الله لا يحب الفحش ولا التفحش"," رواه أبو داود بإسناد حسن إلا قيس بن بشر فاختلفوا في توثيقه وتضعيفه وقد روى له مسلم . ( ضعيف ) .[ فيه : قيس التغلبي ، وهو مجهول",ضعيف,non-authentic,باب صفة طول القميص والكم والإزار وطرف العمامة,
20_1,"20- ( 830 ) عن حذيفة بن اليمان رضي الله عنه أن رسول الله صلى الله عليه وسلم لعن من جلس وسط الحلقة . رواه أبو داود بإسناد حسن .وروى الترمذي عن أبي مجلز : أن رجلا قعد وسط حلقة فقال حذيفة : ملعون على لسان محمد صلى الله عليه وسلم - أو لعن على لسان محمد صلى الله عليه وسلم من جلس وسط الحلقة . قال الترمذي : حديث حسن صحيح .( ضعيف ) .[ فيه انقطاع ، أبو مجلز واسمه لاحق بن حميد لم يسمع من حذيفة ] . ",عن حذيفة بن اليمان رضي الله عنه, أن رسول الله صلى الله عليه وسلم لعن من جلس وسط الحلقة, رواه أبو داود بإسناد حسن .,,non-authentic,باب في آداب المجلس والجليس,
20_2,,.وروى الترمذي عن أبي مجلز, أن رجلا قعد وسط حلقة فقال حذيفة : ملعون على لسان محمد صلى الله عليه وسلم - أو لعن على لسان محمد صلى الله عليه وسلم من جلس وسط الحلقة,". قال الترمذي : حديث حسن صحيح .( ضعيف ) .[ فيه انقطاع ، أبو مجلز واسمه لاحق بن حميد لم يسمع من حذيفة",ضعيف,non-authentic,باب في آداب المجلس والجليس,
21,"21- ( 889 ) عن صفوان بن عسال رضي الله عنه قال : قال يهودي لصحابه اذهب بنا إلى هذا النبي فأتيا رسول الله صلى الله عليه وسلم فسألاه عن تسع آيات بينات فذكر الحديث إلى قوله : فقبلا يده ورجله وقالا : نشهد أنك نبي . رواه الترمذي وغيره بأسانيد صحيحة . ( ضعيف ) .[ فيه : عبد الله بن سلمة - بكسر اللام - ، قال الشيخ الألباني : وهو المرادي وهو مختلف فيه وهو راوي حديث علي في "" النهي عن قراءة القرآن جنبا "" ، وقد ضعفه الحفاظ المحققون كما قال المصنف نفسه ومنهم أحمد والشافعي والبخاري وغيرهم ] .",عن صفوان بن عسال رضي الله عنه قال,: قال يهودي لصحابه اذهب بنا إلى هذا النبي فأتيا رسول الله صلى الله عليه وسلم فسألاه عن تسع آيات بينات فذكر الحديث إلى قوله : فقبلا يده ورجله وقالا : نشهد أنك نبي," رواه الترمذي وغيره بأسانيد صحيحة . ( ضعيف ) .[ فيه : عبد الله بن سلمة - بكسر اللام - ، قال الشيخ الألباني : وهو المرادي وهو مختلف فيه وهو راوي حديث علي في "" النهي عن قراءة القرآن جنبا "" ، وقد ضعفه الحفاظ المحققون كما قال المصنف نفسه ومنهم أحمد والشافعي والبخاري وغيرهم ] .",,non-authentic,"باب استحباب المصافحة عند اللقاء ، وتقبيل ولده ، وبشاشة الوجه",
22,"22- ( 890 ) عن ابن عمر رضي الله عنه قصة قال فيها : فدنونا من النبي صلى الله عليه وسلم فقبلنا يده . رواه أبو داود . ( ضعيف ) .[ إسناده يزيد بن أبي زياد الهاشمي مولاهم ، وهو ضعيف ] .",عن ابن عمر رضي الله عنه قصة قال فيها , فدنونا من النبي صلى الله عليه وسلم فقبلنا يده,". رواه أبو داود . ( ضعيف ) .[ إسناده يزيد بن أبي زياد الهاشمي مولاهم ، وهو ضعيف",ضعيف,non-authentic,"باب استحباب المصافحة عند اللقاء ، وتقبيل ولده ، وبشاشة الوجه",
23,"23- ( 891 ) عن عائشة رضي الله عنها قالت : قدم زيد بن حارثة المدينة ورسول الله صلى الله عليه وسلم في بيتي فأتاه فقرع الباب فقام إليه النبي صلى الله عليه وسلم يجر ثوبه فاعتنقه وقبله . رواه الترمذي وقال : حديث حسن . ( ضعيف ) .[ فيه : محمد بن إسحاق وهو مدلس ، ولم يصرح بالتحديث ] . ",عن عائشة رضي الله عنها قالت, قدم زيد بن حارثة المدينة ورسول الله صلى الله عليه وسلم في بيتي فأتاه فقرع الباب فقام إليه النبي صلى الله عليه وسلم يجر ثوبه فاعتنقه وقبله,". رواه الترمذي وقال : حديث حسن . ( ضعيف ) .[ فيه : محمد بن إسحاق وهو مدلس ، ولم يصرح بالتحديث ] . ",ضعيف,non-authentic,"باب استحباب المصافحة عند اللقاء ، وتقبيل ولده ، وبشاشة الوجه",
24,"24- ( 912 ) عن عائشة رضي الله عنه قالت : رأيت رسول الله صلى الله عليه وسلم وهو بالموت عنده قدح فيه ماء وهو يدخل يده في القدح ثم يمسح وجهه بالماء ثم يقول : "" اللهم أعني على غمرات الموت أو سكرات الموت "" . رواه الترمذي . ( ضعيف ) .[ فيه : موسى بن سرجس ، وهو مجهول ] .",عن عائشة رضي الله عنه قالت," رأيت رسول الله صلى الله عليه وسلم وهو بالموت عنده قدح فيه ماء وهو يدخل يده في القدح ثم يمسح وجهه بالماء ثم يقول : "" اللهم أعني على غمرات الموت أو سكرات الموت"," رواه الترمذي . ( ضعيف ) .[ فيه : موسى بن سرجس ، وهو مجهول ] .",,non-authentic,باب ما يقوله من أيس من حياته,
25,"25- ( 944 ) عن حصين بن وَحْوَح رضي الله عنه أن طلحة بن البراء بن عازب رضي الله عنهما مرض فأتاه النبي صلى الله عليه وسلم يعوده فقال : "" إني لا أرى طلحة إلا قد حدث فيه الموت فآذنوني به وعجلوا به فإنه لا ينبغي لجيفة مسلم أن تحبس بين ظهراني أهله "" . رواه أبو داود . ( ضعيف ) .[ فيه : مجهولان : عروة بن سعيد الأنصاري ، وأبوه ] .",عن حصين بن وَحْوَح رضي الله عنه أن طلحة بن البراء بن عازب رضي الله عنهما مرض فأتاه النبي صلى الله عليه وسلم يعوده فقال, إني لا أرى طلحة إلا قد حدث فيه الموت فآذنوني به وعجلوا به فإنه لا ينبغي لجيفة مسلم أن تحبس بين ظهراني أهله ,"رواه أبو داود . ( ضعيف ) .[ فيه : مجهولان : عروة بن سعيد الأنصاري ، وأبوه ] .",ضعيف,non-authentic,باب تعجيل قضاء الدَّيْن عن الميت والمبادرة إلى تجهيزه إلا أن يموت فجأة فيترك حتى يُتيقن موته,
26,"26- ( 947 ) عن عمرو بن العاص رضي الله عنه قال : إذا دفنتموني فأقيموا حوا قبري قدر ما تنحر جزور ويقسم لحمها حتى أستأنس بكم واعلم ماذا أراجع به رسل ربي . رواه مسلم . قال الشافعي رحمه الله : ويستحب أن يقرأ عنده شيء من القرآن وإن ختموا القرآن عنده كان حسنا . [ قال الشيخ الألباني : لا أدري أين قال ذلك الشافعي رحمه الله تعالى وفي ثبوته عنه شك كبير عندي كيف لا ومذهبه أن القراءة لا يصل إهداء ثوابها إلى الموتى كما نقله عنه الحافظ ابن كثير في تفسير قوله تعالى : { وأن ليس للإنسان إلا ما سعى } وقد أشار شيخ الإسلام ابن تيمية إلى عدم ثبوت ذلك عن الإمام الشافعي بقوله في "" الاقتضاء "" : ( لا يحفظ عن الشافعي نفسه في هذه المسألة كلام وذلك لأن ذلك كان عنده بدعة وقال مالك : ما علمنا أحدا فعل ذلك فعلم أن الصحابة والتابعين ما كانوا يفعلون ذلك ) . قلت : وذلك هو مذهب أحمد أيضا : أن لا قراءة على القبر كما أثبته في كتابي "" أحكام الجنائز "" ، وهو ما انتهى إليه رأي شيخ الإسلام ابن تيمية رحمه الله تعالى كما حققته في كتابي المذكور ] . ",عن عمرو بن العاص رضي الله عنه قال, إذا دفنتموني فأقيموا حوا قبري قدر ما تنحر جزور ويقسم لحمها حتى أستأنس بكم واعلم ماذا أراجع به رسل ربي," رواه مسلم . قال الشافعي رحمه الله : ويستحب أن يقرأ عنده شيء من القرآن وإن ختموا القرآن عنده كان حسنا . [ قال الشيخ الألباني : لا أدري أين قال ذلك الشافعي رحمه الله تعالى وفي ثبوته عنه شك كبير عندي كيف لا ومذهبه أن القراءة لا يصل إهداء ثوابها إلى الموتى كما نقله عنه الحافظ ابن كثير في تفسير قوله تعالى : { وأن ليس للإنسان إلا ما سعى } وقد أشار شيخ الإسلام ابن تيمية إلى عدم ثبوت ذلك عن الإمام الشافعي بقوله في "" الاقتضاء "" : ( لا يحفظ عن الشافعي نفسه في هذه المسألة كلام وذلك لأن ذلك كان عنده بدعة وقال مالك : ما علمنا أحدا فعل ذلك فعلم أن الصحابة والتابعين ما كانوا يفعلون ذلك ) . قلت : وذلك هو مذهب أحمد أيضا : أن لا قراءة على القبر كما أثبته في كتابي "" أحكام الجنائز "" ، وهو ما انتهى إليه رأي شيخ الإسلام ابن تيمية رحمه الله تعالى كما حققته في كتابي المذكور",,non-authentic,باب الدعاء للميت بعد دفنه والقعود عند قبره ساعة للدعاء له والاستغفار والقراءة,
27,"27- ( 1000 ) عن ابن عباس رضي الله عنهما قال : قال رسول الله صلى الله عليه وسلم : "" إن الذي ليس في جوفه شيء من القرآن كالبيت الخرب "" . رواه الترمذي وقال : حديث حسن صحيح . ( ضعيف ) .[ فيه : قابوس بن أبي ظبيان ، وهو ضعيف ] .",عن ابن عباس رضي الله عنهما قال : قال رسول الله صلى الله عليه وسلم, إن الذي ليس في جوفه شيء من القرآن كالبيت الخرب,". رواه الترمذي وقال : حديث حسن صحيح . ( ضعيف ) .[ فيه : قابوس بن أبي ظبيان ، وهو ضعيف",ضعيف,non-authentic,باب فضل قراءة القرآن,كتاب الفضائل
28_1,"28- ( 1021 ) عن أبي الدرداء رضي الله عنه أن رسول الله صلى الله عليه وسلم قال : "" من حفظ عشر آيات من أول سورة الكهف عصم من الدجال "" . وفي رواية : "" من آخر سورة الكهف "" رواهما مسلم . [ قال الشيخ الألباني :قلت : الرواية الأخرى شاذة والمحفوظ الرواية الأولى كما حققته في "" سلسلة الأحاديث الصحيحة "" رقم ( 2651 ) ويشهد له حديث النواس بن سمعان الآتي عند المصنف برقم ( 1808 ) فإن فيه "" فمن أدركه منكم فليقرأ عليه فواتح سورة الكهف "" ] . ",عن أبي الدرداء رضي الله عنه أن رسول الله صلى الله عليه وسلم قال, من حفظ عشر آيات من أول سورة الكهف عصم من الدجال,,,authentic,باب في الحث على سور وآيات مخصوصة,كتاب الفضائل
28_2,,,"وفي رواية : "" من آخر سورة الكهف"," رواهما مسلم . [ قال الشيخ الألباني :قلت : الرواية الأخرى شاذة والمحفوظ الرواية الأولى كما حققته في "" سلسلة الأحاديث الصحيحة "" رقم ( 2651 ) ويشهد له حديث النواس بن سمعان الآتي عند المصنف برقم ( 1808 ) فإن فيه "" فمن أدركه منكم فليقرأ عليه فواتح سورة الكهف",,non-authentic,باب في الحث على سور وآيات مخصوصة,كتاب الفضائل
29,"29- ( 1024 ) عن أبي هريرة رضي الله عنه قال : سمعت رسول الله صلى الله عليه وسلم يقول : "" إن أمتي يدعون يوم القيامة غرا محجلين من آثار الوضوء فمن استطاع منكم أن يطيل غرته فليفعل "" . متفق عليه [ قال الشيخ الألباني : وقوله "" فمن استطاع . . . "" مدرج في الحديث كما قال الحافظ وغيره فراجع له "" الإرواء "" رقم ( 94 ) و "" الضعيفة "" رقم ( 1030 ) ] . ",عن أبي هريرة رضي الله عنه قال : سمعت رسول الله صلى الله عليه وسلم يقول , إن أمتي يدعون يوم القيامة غرا محجلين من آثار الوضوء فمن استطاع منكم أن يطيل غرته فليفعل," متفق عليه [ قال الشيخ الألباني : وقوله "" فمن استطاع . . . "" مدرج في الحديث كما قال الحافظ وغيره فراجع له "" الإرواء "" رقم ( 94 ) و "" الضعيفة "" رقم ( 1030",,non-authentic,باب فضل الوضوء,كتاب الفضائل
30,"30- ( 1060 ) عن أبي سعيد الخدري رضي الله عنه عن النبي صلى الله عليه وسلم قال : "" إذا رأيتم الرجل يعتاد المساجد فاشهدوا له بالإيمان قال الله عز وجل { إنما يعمر مساجد الله من آمن بالله واليوم الآخر . . الآية } رواه الترمذي وقال : حديث حسن .( ضعيف ) .[ فيه : دراج أبو السمح وهو ضعيف في حديثه عن أبي الهيثم ، وهذه منها ] .",عن أبي سعيد الخدري رضي الله عنه عن النبي صلى الله عليه وسلم قال, إذا رأيتم الرجل يعتاد المساجد فاشهدوا له بالإيمان قال الله عز وجل { إنما يعمر مساجد الله من آمن بالله واليوم الآخر . . الآية ," رواه الترمذي وقال : حديث حسن .( ضعيف ) .[ فيه : دراج أبو السمح وهو ضعيف في حديثه عن أبي الهيثم ، وهذه منها",ضعيف,non-authentic,باب فضل المشي إلى المساجد,كتاب الفضائل
31,"31- ( 1094 ) عن عائشة رضي الله عنها قات : قال رسول الله صلى الله عليه وسلم : "" إن الله وملائكته يصلون على ميامن الصفوف "" رواه أبو داود بإسناد على شرط مسلم وفيه رجل مختلف في توثيقه . ( شاذ ) .[ قال الشيخ الألباني :والمحفوظ - كما قال البيهقي - إنما هو بلفظ : "" . . . على الذي يصلون الصفوف "" كما ذكرته في تعليقي على "" المشكاة "" ، وبينته في كتابي "" ضعيف أبي داود "" و "" صحيح أبي داود "" ) ] . ",عن عائشة رضي الله عنها قات : قال رسول الله صلى الله عليه وسلم, إن الله وملائكته يصلون على ميامن الصفوف," رواه أبو داود بإسناد على شرط مسلم وفيه رجل مختلف في توثيقه . ( شاذ ) .[ قال الشيخ الألباني :والمحفوظ - كما قال البيهقي - إنما هو بلفظ : "" . . . على الذي يصلون الصفوف "" كما ذكرته في تعليقي على "" المشكاة "" ، وبينته في كتابي "" ضعيف أبي داود "" و "" صحيح أبي داود",,non-authentic,"باب فضل الصف الأول ، والأمر بإتمام الصفوف الأُوَل ، وتسويتها ، والتراص فيها",كتاب الفضائل
32,"32- ( 1096 ) عن أبي هريرة رضي الله عنه قال : قال رسول الله صلى الله عليه وسلم : "" وسطوا الإمام وسدوا الخلل "" رواه أبو داود .( أوله ضعيف ) .[ فيه : مجهولان ، لكن الشطر الثاني منه له شواهد ] . ",عن أبي هريرة رضي الله عنه قال : قال رسول الله صلى الله عليه وسلم, وسطوا الإمام وسدوا الخلل," رواه أبو داود .( أوله ضعيف ) .[ فيه : مجهولان ، لكن الشطر الثاني منه له شواهد", أوله ضعيف,non-authentic,"باب فضل الصف الأول ، والأمر بإتمام الصفوف الأُوَل ، وتسويتها ، والتراص فيها",كتاب الفضائل
33,"33- ( 1121 ) عن علي بن أبي طالب رضي الله عنه أن النبي صلى الله عليه وسلم كان يصلي قبل العصر ركعتين . رواه أبو داود بإسناد صحيح . ( شاذ بهذا اللفظ ) . [ والمحفوظ بلفظ : "" أربع ركعات "" ] .",عن علي بن أبي طالب رضي الله عنه, أن النبي صلى الله عليه وسلم كان يصلي قبل العصر ركعتين," رواه أبو داود بإسناد صحيح . ( شاذ بهذا اللفظ ) . [ والمحفوظ بلفظ : "" أربع ركعات", شاذ بهذا اللفظ,non-authentic,باب سنة العصر,كتاب الفضائل
34,"34- ( 1157 ) عن أبي بردة بن أبي موسى رضي الله عنه قال : قال عبد الله بن عمر رضي الله عنهما : أسمعت أباك يحدث عن رسول الله صلى الله عليه وسلم في شأن ساعة الجمعة ؟ قال : قلت : نعم سمعته يقول : سمعت رسول الله صلى الله عليه وسلم يقول : "" هي ما بين أن يجلس الإمام إلى أن تقضى الصلاة "" . رواه مسلم ( ضعيف مرفوعاً ، صحيح موقوفاً ) .[ صحح الأئمة وقفه على أبي موسى الأشعري ، ومنهم الإمام الدارقطني ] .",عن أبي بردة بن أبي موسى رضي الله عنه قال : قال عبد الله بن عمر رضي الله عنهما : أسمعت أباك يحدث عن رسول الله صلى الله عليه وسلم في شأن ساعة الجمعة ؟ قال : قلت : نعم سمعته يقول : سمعت رسول الله صلى الله عليه وسلم يقول , هي ما بين أن يجلس الإمام إلى أن تقضى الصلاة,". رواه مسلم ( ضعيف مرفوعاً ، صحيح موقوفاً ) .[ صحح الأئمة وقفه على أبي موسى الأشعري ، ومنهم الإمام الدارقطني",ضعيف,non-authentic,"باب فضل يوم الجمعة ووجوبها والاغتسال لها ، والطيب ، والتكبير إليها ",كتاب الفضائل
