No.,Full Hadith,Isnad,Matan,Author's Comments,Degree,Authenticity,Topic,
35,"35- ( 1159 ) عن سعد بن أبي وقاص رضي الله عنه قال : خرجنا مع رسول الله صلى الله عليه وسلم من مكة نريد المدينة فلما كنا قريبا من عزوراء نزل ثم رفع يديه فدعا الله ساعة ثم خر ساجدا فمكث طويلا ثم قام فرع يديه ساعة ثم خر ساجدا - فعله ثلاثا - وقال : "" إني سألت ربي وشفعت لأمتي فأعطاني ثلث أمتي فخررت ساجدا لربي شكرا ثم رفعت رأسي فسألت ربي لأمتي فأعطاني ثلث أمتي فخررت ساجدا لربي شكرا ثم رفعت رأسي فسألت ربي لأمتي فأعطاني الثلث الأخير فخررت ساجدا لربي "" رواه أبو داود .( ضعيف ) .[ فيه : موسى بن يعقوب الزمعي ، وهو سيء الحفظ ، وشيخه يحيى بن الحسن بن عثمان ، وهو مجهول ] . وسجود الشكر ثابت في غير ما حديث عن النبي صلى الله عليه وأصحابه .",عن سعد بن أبي وقاص رضي الله عنه قال,": خرجنا مع رسول الله صلى الله عليه وسلم من مكة نريد المدينة فلما كنا قريبا من عزوراء نزل ثم رفع يديه فدعا الله ساعة ثم خر ساجدا فمكث طويلا ثم قام فرع يديه ساعة ثم خر ساجدا - فعله ثلاثا - وقال : "" إني سألت ربي وشفعت لأمتي فأعطاني ثلث أمتي فخررت ساجدا لربي شكرا ثم رفعت رأسي فسألت ربي لأمتي فأعطاني ثلث أمتي فخررت ساجدا لربي شكرا ثم رفعت رأسي فسألت ربي لأمتي فأعطاني الثلث الأخير فخررت ساجدا لربي"," رواه أبو داود .( ضعيف ) .[ فيه : موسى بن يعقوب الزمعي ، وهو سيء الحفظ ، وشيخه يحيى بن الحسن بن عثمان ، وهو مجهول ] . وسجود الشكر ثابت في غير ما حديث عن النبي صلى الله عليه وأصحابه",ضعيف,non-authentic,باب استحباب سجود الشكر عند حصولنعمة ظاهرة أو اندفاع بلية ظاهرة,كتاب الفضائل
36,"36- ( 1179 ) عن أبي هريرة رضي الله عنه أن النبي صلى الله عليه وسلم قال : "" إذا قام أحدكم من الليل فليفتتح الصلاة بركعتين خفيفتين "" رواه مسلم . ( شاذ بهذا اللفظ ) .[ قال الشيخ الألباني : وهو عند غير مسلم عن أبي هريرة مرفوعا من فعله صلى الله عليه وسلم وهو الصواب وأما من قوله فشاذ كما حققته في "" ضعيف أبي داود "" ] .",عن أبي هريرة رضي الله عنه أن النبي صلى الله عليه وسلم قال, إذا قام أحدكم من الليل فليفتتح الصلاة بركعتين خفيفتين," رواه مسلم . ( شاذ بهذا اللفظ ) .[ قال الشيخ الألباني : وهو عند غير مسلم عن أبي هريرة مرفوعا من فعله صلى الله عليه وسلم وهو الصواب وأما من قوله فشاذ كما حققته في  ضعيف أبي داود "" ] .",ضعيف,non-authentic,باب فضل قيام الليل,كتاب الفضائل
37,"37- ( 1235 ) عن أبي هريرة رضي الله عنه قال : قال رسول الله صلى الله عليه وسلم : "" قال الله عز وجل : أحب عبادي إلي أعجلهم فطرا "" رواه الترمذي وقال : حديث حسن . ( ضعيف ) .[ فيه : قرة بن عبد الرحمن وهو : ضعيف لسوء حفظه ] . ",عن أبي هريرة رضي الله عنه قال : قال رسول الله صلى الله عليه وسلم, قال الله عز وجل : أحب عبادي إلي أعجلهم فطرا , رواه الترمذي وقال : حديث حسن . ( ضعيف ) .[ فيه : قرة بن عبد الرحمن وهو : ضعيف لسوء حفظه,ضعيف,non-authentic,"باب فضل تعجيل الفطر ، وما يفطر عليه ، وما يقوله بعد الإفطار",كتاب الفضائل
38,"38- ( 1248 ) عن مجيبة الباهلية عن أبيها أو عمها أنه أتى رسول الله صلى الله عليه وسلم ثم انطلق فأتاه بعد سنة - وقد تغيرت حالته وهيئته - فقال : يا رسول الله أما تعرفني ؟ قال : "" ومن أنت "" قال : أنا الباهلي الذي جئتم عام الأول . قال : "" فما غيرك وقد كنت حسن الهيئة "" قال : ما أكلت طعاما منذ فارقتك إلا بليل . فقال رسول الله صلى الله عليه وسلم : "" عذبت نفسك "" ثم قال : "" صم شهر الصبر ويوما من كل شهر "" قال : زدني قال : "" صم من الحرم واترك صم من الحرم واترك صم من الحرم واترك "" وقال بأصابعه الثلاث فضمها ثم أرسلها . رواه أبو داود . وشهر الصبر رمضان . ( ضعيف ) .[ فيه مجيبة الباهلية ، وهي مجهولة ] .",عن مجيبة الباهلية عن أبيها أو عمها ," أنه أتى رسول الله صلى الله عليه وسلم ثم انطلق فأتاه بعد سنة - وقد تغيرت حالته وهيئته - فقال : يا رسول الله أما تعرفني ؟ قال : "" ومن أنت "" قال : أنا الباهلي الذي جئتم عام الأول . قال : "" فما غيرك وقد كنت حسن الهيئة "" قال : ما أكلت طعاما منذ فارقتك إلا بليل . فقال رسول الله صلى الله عليه وسلم : "" عذبت نفسك "" ثم قال : "" صم شهر الصبر ويوما من كل شهر "" قال : زدني قال : "" صم من الحرم واترك صم من الحرم واترك صم من الحرم واترك "" وقال بأصابعه الثلاث فضمها ثم أرسلها "," رواه أبو داود . وشهر الصبر رمضان . ( ضعيف ) .[ فيه مجيبة الباهلية ، وهي مجهولة",ضعيف,non-authentic,باب فضل صوم المحرَّم وشعبان والأشهر الحرُم,كتاب الفضائل
39,"39- ( 1266 ) عن أم عمارة الأنصارية رضي الله عنها أن النبي صلى الله عليه وسلم دخل عليها فقدمت إليه طعاما فقال : "" كلي "" فقالت : إني صائمة فقال رسول الله صلى الله عليه وسلم : "" إن الصائم تصلي عليه الملائكة إذا أكل عنده حتى يفرغوا "" وربما قال : "" حتى يشبعوا "" رواه الترمذي وقال : حديث حسن . ( ضعيف ) .[ فيه ليلى ، وهي مجهولة ] .",عن أم عمارة الأنصارية رضي الله عنها ," أن النبي صلى الله عليه وسلم دخل عليها فقدمت إليه طعاما فقال : "" كلي "" فقالت : إني صائمة فقال رسول الله صلى الله عليه وسلم : "" إن الصائم تصلي عليه الملائكة إذا أكل عنده حتى يفرغوا "" وربما قال : "" حتى يشبعوا "," رواه الترمذي وقال : حديث حسن . ( ضعيف ) .[ فيه ليلى ، وهي مجهولة",ضعيف,non-authentic,"باب فضل من فطَّر صائماً ، وفضل الصائم الذي يؤكل عنده ، ودعاء الآكل للمأكول عنده ",كتاب الفضائل
40,"40- ( 1335 ) عن عقبة بن عامر الجهني رضي الله عنه قال : سمعت رسول الله صلى الله عليه وسلم : "" إن الله يدخل بالسهم الواحد ثلاثة نفر الجنة : صانعه يحتسب في صنعته الخير والرامي به ومنبله وارموا واركبوا وأن ترموا أحب إلي من أن تركبوا ومن ترك الرمي بعد ما علمه رغبة عنه فإنها نعمة تركها "" أو قال : "" كفرها "" رواه أبو داود .( ضعيف ، وآخره – "" من ترك الرمي ... "" صحيح ) .[ فيه : جهالة ، واضطراب ، كما قال الشيخ الألباني "" ضعيف الترغيب "" ( 821 ) ] .",عن عقبة بن عامر الجهني رضي الله عنه قال : سمعت رسول الله صلى الله عليه وسلم ," إن الله يدخل بالسهم الواحد ثلاثة نفر الجنة : صانعه يحتسب في صنعته الخير والرامي به ومنبله وارموا واركبوا وأن ترموا أحب إلي من أن تركبوا ومن ترك الرمي بعد ما علمه رغبة عنه فإنها نعمة تركها "" أو قال : "" كفرها "," رواه أبو داود .( ضعيف ، وآخره – "" من ترك الرمي ... "" صحيح ) .[ فيه : جهالة ، واضطراب ، كما قال الشيخ الألباني "" ضعيف الترغيب "" "," ضعيف ، وآخره – "" من ترك الرمي ... "" صحيح",authentic/non-authentic,كتاب الجهاد,
41,"41- ( 1386 ) عن أبي سعيد الخدري رضي الله عنه عن رسول الله صلى الله عليه وسلم قال : "" لن يشبع مؤمن من خير حتى يكون منتهاه إلى الجنة "" رواه الترمذي وقال : حديث حسن .( ضعيف ) .[ فيه : دراج أبو السمح وهو ضعيف في حديثه عن أبي الهيثم ، وهذه منها ] .",عن أبي سعيد الخدري رضي الله عنه عن رسول الله صلى الله عليه وسلم قال, لن يشبع مؤمن من خير حتى يكون منتهاه إلى الجنة," رواه الترمذي وقال : حديث حسن .( ضعيف ) .[ فيه : دراج أبو السمح وهو ضعيف في حديثه عن أبي الهيثم ، وهذه منها ] .",ضعيف,non-authentic,كتاب العلم,
42,"42- ( 1394 ) عن أبي هريرة رضي الله عنه عن النبي صلى الله عليه وسلم قال : "" كل أمر ذي بال لا يبدأ فيه بالحمد الله فهو أقطع "" حديث حسن رواه أبو داود وغيره . ( ضعيف ) .[ فيه : قرة بن عبد الرحمن المعافري ، وهو منكر الحديث جدّاً ] .",عن أبي هريرة رضي الله عنه عن النبي صلى الله عليه وسلم قال, كل أمر ذي بال لا يبدأ فيه بالحمد الله فهو أقطع," حديث حسن رواه أبو داود وغيره . ( ضعيف ) .[ فيه : قرة بن عبد الرحمن المعافري ، وهو منكر الحديث جدّا",ضعيف,non-authentic,كتاب حمد الله تعالى وشكره,
43,"43- ( 1442 ) عن سعد بن أبي وقاص رضي الله عنه أنه دخل مع رسول الله صلى الله عليه وسلم على امرأة وبين يديها نوى - أو حصى - تسبح به فقال : "" أخبرك بما هو أيسر عليك من هذا - أو أفضل - "" فقال : "" سبحان الله عدد ما خلق في السماء وسبحان الله عدد ما خلق في الأرض وسبحان الله عدد ما بين ذلك وسبحان الله عدد ما هو خالق والله أكبر مثل ذلك والحمد الله مثل ذلك ولا إله إلا الله مثل ذلك ولا حول ولا قوة إلا بالله مثل ذلك "" رواه الترمذي وقال : حديث حسن . ( ضعيف ) .[ فيه : خزيمة ، وهو مجهول ] .",عن سعد بن أبي وقاص رضي الله عنه," أنه دخل مع رسول الله صلى الله عليه وسلم على امرأة وبين يديها نوى - أو حصى - تسبح به فقال : "" أخبرك بما هو أيسر عليك من هذا - أو أفضل - "" فقال : "" سبحان الله عدد ما خلق في السماء وسبحان الله عدد ما خلق في الأرض وسبحان الله عدد ما بين ذلك وسبحان الله عدد ما هو خالق والله أكبر مثل ذلك والحمد الله مثل ذلك ولا إله إلا الله مثل ذلك ولا حول ولا قوة إلا بالله مثل ذلك"," رواه الترمذي وقال : حديث حسن . ( ضعيف ) .[ فيه : خزيمة ، وهو مجهول",ضعيف,non-authentic,باب فضل الذكر والحث عليه,كتاب الأذكار
44,"44- ( 1487 ) عن عمران بن الحصين رضي الله عنهما أن النبي صلى الله عليه وسلم علم أباه حصينا كلمتين يدعو بهما : "" اللهم ألهمني رشدي وأعذني من شر نفسي "" رواه الترمذي وقال : حديث حسن . ( ضعيف ) .[ قال الشيخ الألباني :كذا قال – أي : الترمذي - : ولعله في بعض نسخ الترمذي وإلا ففي نسخ "" بولاق "" : ( حديث غريب ) يعني : ضعيف ، وهو اللائق بحال إسناده ؛ فإن فيه انقطاعا وضعفا ، لا سيما وقد رواه ابن حبان وأحمد من طريق أخرى : "" اللهم قني شر نفسي واعزم على رشدي أمري "" . وسنده صحيح على شرط الشيخين . وروى أحمد عنه صلى الله عليه وسلم أنه قال : "" اللهم اغفر لي ذنبي خطئي وعمدي اللهم إني أستهديك لأرشد أمري وأعوذ بك من شر نفسي "" وسنده جيد ] . ",عن عمران بن الحصين رضي الله عنهما,"ا أن النبي صلى الله عليه وسلم علم أباه حصينا كلمتين يدعو بهما : "" اللهم ألهمني رشدي وأعذني من شر نفسي","رواه الترمذي وقال : حديث حسن . ( ضعيف ) .[ قال الشيخ الألباني :كذا قال – أي : الترمذي - : ولعله في بعض نسخ الترمذي وإلا ففي نسخ "" بولاق "" : ( حديث غريب ) يعني : ضعيف ، وهو اللائق بحال إسناده ؛ فإن فيه انقطاعا وضعفا ، لا سيما وقد رواه ابن حبان وأحمد من طريق أخرى : "" اللهم قني شر نفسي واعزم على رشدي أمري "" . وسنده صحيح على شرط الشيخين . وروى أحمد عنه صلى الله عليه وسلم أنه قال : "" اللهم اغفر لي ذنبي خطئي وعمدي اللهم إني أستهديك لأرشد أمري وأعوذ بك من شر نفسي "" وسنده جيد",ضعيف,non-authentic,كتاب الدعوات,
45,"45- ( 1490 ) عن أبي الدرداء رضي الله عنه قال : قال رسول الله صلى الله عليه وسلم : "" كان من دعاء داود عليه الصلاة والسلام : اللهم إني أسألك حبك وحب من يحبك والعمل الذي يبلغني حبك اللهم اجعل حبك أحب إلي من نفسي وأهلي ومن الماء البارد : "" رواه الترمذي وقال : حديث حسن . ( ضعيف ) .[ فيه : عبد الله بن ربيعة الدمشقي ، وهو مجهول ] .",عن أبي الدرداء رضي الله عنه قال : قال رسول الله صلى الله عليه وسلم, كان من دعاء داود عليه الصلاة والسلام : اللهم إني أسألك حبك وحب من يحبك والعمل الذي يبلغني حبك اللهم اجعل حبك أحب إلي من نفسي وأهلي ومن الماء البارد," رواه الترمذي وقال : حديث حسن . ( ضعيف ) .[ فيه : عبد الله بن ربيعة الدمشقي ، وهو مجهول",ضعيف,non-authentic,كتاب الدعوات,
46,"46- ( 1493 ) عن ابن مسعود رضي الله عنه قال : كان من دعاء رسول الله صلى الله عليه وسلم : "" اللهم إني أسألك موجبات رحمتك وعزائم مغفرتك والسلامة من كل إثم والغنيمة من كل بر والفوز بالجنة والنجاة من النار "" رواه الحاكم أبو عبد الله وقال : حديث صحيح على شرط مسلم . ( ضعيف جدّاً ) .[ فيه : حميد الأعرج ، وهو متروك الحديث ] .",عن ابن مسعود رضي الله عنه قال : ," كان من دعاء رسول الله صلى الله عليه وسلم : "" اللهم إني أسألك موجبات رحمتك وعزائم مغفرتك والسلامة من كل إثم والغنيمة من كل بر والفوز بالجنة والنجاة من النار"," رواه الحاكم أبو عبد الله وقال : حديث صحيح على شرط مسلم . ( ضعيف جدّاً ) .[ فيه : حميد الأعرج ، وهو متروك الحديث",ضعيف جدّاً ,non-authentic,كتاب الدعوات,
47,"47- ( 1518 ) عن ابن عمر رضي الله عنهما قال : قال رسول الله صلى الله عليه وسلم : "" لا تكثروا الكلام بغير ذكر الله فإن كثرة الكلام بغير ذكر الله تعالى قسوة للقلب وإن أبعد الناس من الله القلب القاسي "" رواه الترمذي . ( ضعيف ) .[ فيه : إبراهيم بن عبد الله بن حاطب ، وهو مجهول ] .",عن ابن عمر رضي الله عنهما قال : قال رسول الله صلى الله عليه وسلم , لا تكثروا الكلام بغير ذكر الله فإن كثرة الكلام بغير ذكر الله تعالى قسوة للقلب وإن أبعد الناس من الله القلب القاسي," رواه الترمذي . ( ضعيف ) .[ فيه : إبراهيم بن عبد الله بن حاطب ، وهو مجهول ] .",ضعيف,non-authentic,باب تحريم الغيبة والأمر بحفظ اللسان,كتاب الأمور المنهي عنها
48,"48- ( 1539 ) عن ابن مسعود رضي الله عنه قال : قال رسول الله صلى الله عليه وسلم : "" لا يبلغني أحد من أصحابي عن أحد شيئا فإني أحب أن أخرج إليكم وأنا سليم الصدر "" رواه أبو داود والترمذي . ( ضعيف ) .[ فيه الوليد بن أبي هشام ، وهو مجهول ] . ",عن ابن مسعود رضي الله عنه قال : قال رسول الله صلى الله عليه وسلم, لا يبلغني أحد من أصحابي عن أحد شيئا فإني أحب أن أخرج إليكم وأنا سليم الصدر," رواه أبو داود والترمذي . ( ضعيف ) .[ فيه الوليد بن أبي هشام ، وهو مجهول",ضعيف,non-authentic,باب النهي عن نقل الحديث وكلام الناس إلى ولاة الأمور إذا لم تدع حاجة إليه كخوف مفسدة ونحوها,كتاب الأمور المنهي عنها
49,"49- ( 1569 ) عن أبي هريرة رضي الله عنه أن النبي صلى الله عليه وسلم قال : "" إياكم والحسد فإن الحسد يأكل الحسنات كما تأكل النار الحطب "" أو قال : "" العشب "" رواه أبو داود . ( ضعيف ) .[ فيه : جد إبراهيم بن أبي أسيد ، وهو مجهول ] . ",عن أبي هريرة رضي الله عنه أن النبي صلى الله عليه وسلم قال," إياكم والحسد فإن الحسد يأكل الحسنات كما تأكل النار الحطب "" أو قال : "" العشب"," رواه أبو داود . ( ضعيف ) .[ فيه : جد إبراهيم بن أبي أسيد ، وهو مجهول",ضعيف,non-authentic,باب النهي عن التجسس والتسمع لكلام من يكره استماعه,كتاب الأمور المنهي عنها
50,"50- ( 1577 ) عن واثلة بن الأسقع رضي الله عنه قال : قال رسول الله صلى الله عليه وسلم : "" لا تظهر الشماتة لأخيك فيرحمه الله ويبتليك "" رواه الترمذي وقال : حديث حسن . وفي الباب حديث أبي هريرة السابق في باب التجسس : "" كل المسلم على المسلم حرام "" الحديث . ( ضعيف )[ فيه : القاسم بن أمية ، يروي المناكير عن حفص بن غياث ، وهذا منها ] .",عن واثلة بن الأسقع رضي الله عنه قال : قال رسول الله صلى الله عليه وسلم, لا تظهر الشماتة لأخيك فيرحمه الله ويبتليك," رواه الترمذي وقال : حديث حسن . وفي الباب حديث أبي هريرة السابق في باب التجسس :  كل المسلم على المسلم حرام "" الحديث . ( ضعيف )[ فيه : القاسم بن أمية ، يروي المناكير عن حفص بن غياث ، وهذا منها",ضعيف,non-authentic,باب النهي عن إظهار الشماتة بالمسلم,كتاب الأمور المنهي عنها
51,"51- ( 1626 ) عن أم سلمة رضي الله عنها قالت : كنت عند رسول الله صلى الله عليه وسلم وعنده ميمونة فأقبل ابن أم مكتوم وذلك بعد أن أمرنا بالحجاب فقال النبي صلى الله عليه وسلم : "" احتجبا منه "" فقلنا : يا رسول الله أليس هو أعمى لا يبصرنا ولا يعرفنا ؟ فقال النبي صلى الله عليه وسلم : "" أفعمياوان أنتما ألستما تبصرانه ؟ "" رواه أبو داود والترمذي وقال : حديث حسن صحيح . ( ضعيف ) .[ فيه : نبهان مولى أم سلمة ، وهو مجهول ] .",عن أم سلمة رضي الله عنها قالت," كنت عند رسول الله صلى الله عليه وسلم وعنده ميمونة فأقبل ابن أم مكتوم وذلك بعد أن أمرنا بالحجاب فقال النبي صلى الله عليه وسلم : "" احتجبا منه "" فقلنا : يا رسول الله أليس هو أعمى لا يبصرنا ولا يعرفنا ؟ فقال النبي صلى الله عليه وسلم : "" أفعمياوان أنتما ألستما تبصرانه "," رواه أبو داود والترمذي وقال : حديث حسن صحيح . ( ضعيف ) .[ فيه : نبهان مولى أم سلمة ، وهو مجهول",ضعيف,non-authentic,باب تحريم النظر إلى المرأة الأجنبية والأمرد الحسن لغير حاجة شرعية,كتاب الأمور المنهي عنها
52,52- ( 1641 ) عن علي رضي الله عنه قال : نهى رسول الله صلى الله عليه وسلم أن تحلق المرأة رأسها رواه النسائي . ( ضعيف ) .[ فيه : اضطراب في إسناده ] .,عن علي رضي الله عنه قال,: نهى رسول الله صلى الله عليه وسلم أن تحلق المرأة رأسها , رواه النسائي . ( ضعيف ) .[ فيه : اضطراب في إسناده,ضعيف,non-authentic,باب النهي عن القزع وهو حلق بعض الرأس دون بعض وإباحة حلقه كله للرجل دون المرأة,كتاب الأمور المنهي عنها
53,"53- ( 1670 ) عن قبيصة بن المخارق رضي الله عنه قال : سمعت رسول الله صلى الله عليه وسلم يقول : "" العيافة والطيرة والطرق من الجبت "" رواه أبو داود بإسناد حسن . ( ضعيف ) .[ فيه : حيان بن علاء ، وهو مجهول ] .",عن قبيصة بن المخارق رضي الله عنه قال : سمعت رسول الله صلى الله عليه وسلم يقول, العيافة والطيرة والطرق من الجبت," رواه أبو داود بإسناد حسن . ( ضعيف ) .[ فيه : حيان بن علاء ، وهو مجهول",ضعيف,non-authentic,باب النهي عن إتيان الكهان والمنجمين والعراف وأصحاب الرمل والطوارق بالحصي وبالشعير ونحو ذلك,كتاب الأمور المنهي عنها
